ID,Date & Time,Name,Email,Phone,Message,Status
1704096000000,"1/1/2024, 10:00:00 AM","John Smith","john.smith@email.com","555-0101","I'm interested in the Modern Family Home listed for $750,000. Could you please provide more details about the property and schedule a viewing?","New"
1704099600000,"1/1/2024, 11:00:00 AM","Sarah Johnson","sarah.j@gmail.com","555-0102","Looking for a 3-bedroom house in Green Valley area. My budget is around $500,000. Do you have any available properties?","Contacted"
1704103200000,"1/1/2024, 12:00:00 PM","Mike Davis","mike.davis@company.com","555-0103","Interested in investment properties. Can you send me a list of rental properties with good ROI potential?","New"
1704106800000,"1/1/2024, 1:00:00 PM","Emily Chen","emily.chen@yahoo.com","555-0104","I saw the Luxury Penthouse listing. Is it still available? I'd like to schedule a tour this weekend.","Resolved"
1704110400000,"1/1/2024, 2:00:00 PM","Robert Wilson","r.wilson@outlook.com","555-0105","First-time home buyer here. Could you help me understand the home buying process and what I need to prepare?","Contacted"
1704114000000,"1/1/2024, 3:00:00 PM","Lisa Brown","lisa.brown.realtor@email.com","555-0106","I represent a client looking for commercial properties. Do you handle commercial real estate transactions?","New"
1704117600000,"1/1/2024, 4:00:00 PM","David Martinez","david.m87@gmail.com","555-0107","Selling my current home and looking to upgrade. Can you provide both selling and buying services?","New"
1704121200000,"1/1/2024, 5:00:00 PM","Jennifer Taylor","jenny.taylor@email.com","555-0108","Property management inquiry - I have 3 rental properties that need professional management. What are your rates?","Contacted" 